outputs/reports/260423_PAAD_V2_original_core/benchmark_best_by_split.csv

variant,split,model,status,spearman,pearson,kendall,rmse,mae,r2,fold_spearman_mean,fold_spearman_std,folds,members,n_eval,sensitivity_auroc,sensitivity_auprc
legacy_rich_valid_smiles_only,drug_group_4fold,weighted_top3_ensemble,completed,0.5768402839261534,0.6141910004414614,0.41452650597296287,2.186226065119158,1.6478737592697144,0.3768746342887601,,,[],"[{'model': 'flat_mlp', 'spearman': 0.5559867253202707, 'weight': 0.34149035811424255}, {'model': 'randomforest', 'spearman': 0.5379678410805796, 'weight': 0.3304230868816376}, {'model': 'xgboost', 'spearman': 0.5341637817188954, 'weight': 0.32808658480644226}]",6219,0.7974145733642637,0.6891334817477581
legacy_rich_valid_smiles_only,drug_group_4fold,flat_mlp,completed,0.5559867253202707,0.6076199716331067,0.39971759762199327,2.203289702190746,1.657172441482544,0.36710959399650933,0.5493938780362544,0.0838616980454949,"[{'fold': 1, 'n_train': 4664, 'n_valid': 1555, 'spearman': 0.6378813635624446, 'pearson': 0.7394023240324307, 'kendall': 0.46103633028195085, 'rmse': 1.9507324212639, 'mae': 1.5725517272949219, 'r2': 0.5415505247807598}, {'fold': 2, 'n_train': 4664, 'n_valid': 1555, 'spearman': 0.60130128251406, 'pearson': 0.6386947519458576, 'kendall': 0.4441273610379823, 'rmse': 2.1755121088587432, 'mae': 1.5783953666687012, 'r2': 0.37571574631188875}, {'fold': 3, 'n_train': 4665, 'n_valid': 1554, 'spearman': 0.5414513978656169, 'pearson': 0.5332134694558134, 'kendall': 0.3901374017967992, 'rmse': 2.6513290599238304, 'mae': 1.904648780822754, 'r2': 0.23244814069521602}, {'fold': 4, 'n_train': 4664, 'n_valid': 1555, 'spearman': 0.4169414682028961, 'pearson': 0.49302490741500676, 'kendall': 0.291291457820397, 'rmse': 1.962545396802142, 'mae': 1.5732522010803223, 'r2': 0.15273650831311425}]",,6219,0.7823509250002427,0.6799208797914081
legacy_rich_all_drugs_zero_smiles,drug_group_4fold,weighted_top3_ensemble,completed,0.5470043283405249,0.5935110014634501,0.3917439904012539,2.152370667332536,1.6136553287506104,0.34919669859856817,,,[],"[{'model': 'xgboost', 'spearman': 0.5220153943002046, 'weight': 0.3403460383415222}, {'model': 'flat_mlp', 'spearman': 0.511754320923505, 'weight': 0.33365598320961}, {'model': 'residual_mlp', 'spearman': 0.5000086606008838, 'weight': 0.3259979486465454}]",7513,0.7700162209778378,0.6574744053400315
colonstyle_compact_baseline,drug_group_4fold,weighted_top3_ensemble,completed,0.5415354688510534,0.5740723152620156,0.3868564089036752,2.189053338172577,1.653361201286316,0.32682459796995944,,,[],"[{'model': 'randomforest', 'spearman': 0.5382862059667267, 'weight': 0.352969229221344}, {'model': 'extratrees', 'spearman': 0.5011165852157121, 'weight': 0.3285960853099823}, {'model': 'xgboost', 'spearman': 0.48562032063348487, 'weight': 0.3184347450733185}]",7513,0.7698691793491126,0.6442901885599791
colonstyle_compact_baseline,drug_group_4fold,randomforest,completed,0.5382862059667267,0.5733738373808062,0.38347604161109494,2.1913730666424214,1.6627247333526611,0.32539697800143874,0.5408759245117971,0.0369067136778478,"[{'fold': 1, 'n_train': 5635, 'n_valid': 1878, 'spearman': 0.528935562160788, 'pearson': 0.5704161003620567, 'kendall': 0.3782486572321349, 'rmse': 2.1674671039482925, 'mae': 1.691380262374878, 'r2': 0.32427952138953564}, {'fold': 2, 'n_train': 5634, 'n_valid': 1879, 'spearman': 0.550785455303319, 'pearson': 0.6335711620763771, 'kendall': 0.3951090393781229, 'rmse': 2.121749186542958, 'mae': 1.647538423538208, 'r2': 0.384295134247864}, {'fold': 3, 'n_train': 5635, 'n_valid': 1878, 'spearman': 0.5929089297387184, 'pearson': 0.6663160089292929, 'kendall': 0.42468650008158426, 'rmse': 1.8883569527832595, 'mae': 1.4929028749465942, 'r2': 0.43950197435547766}, {'fold': 4, 'n_train': 5635, 'n_valid': 1878, 'spearman': 0.4908737508443632, 'pearson': 0.42170219266451264, 'kendall': 0.34541113374479154, 'rmse': 2.5383063965852424, 'mae': 1.8190852403640747, 'r2': 0.17411348333330312}]",,7513,0.768530029140057,0.6450537372677695
legacy_rich_valid_smiles_only,drug_group_4fold,randomforest,completed,0.5379678410805796,0.576728867495637,0.3841246538470142,2.263194075707253,1.6995997428894043,0.3322269551342044,0.5395112700496849,0.0886411076758309,"[{'fold': 1, 'n_train': 4664, 'n_valid': 1555, 'spearman': 0.6658822713015943, 'pearson': 0.7014819292530655, 'kendall': 0.4791619507637381, 'rmse': 2.086199111820676, 'mae': 1.606863260269165, 'r2': 0.47566652311080426}, {'fold': 2, 'n_train': 4664, 'n_valid': 1555, 'spearman': 0.5057614122647609, 'pearson': 0.5834387026101124, 'kendall': 0.36272594434278904, 'rmse': 2.3410234995709063, 'mae': 1.7410887479782104, 'r2': 0.2771121957467628}, {'fold': 3, 'n_train': 4665, 'n_valid': 1554, 'spearman': 0.5640207622582506, 'pearson': 0.5418295875354416, 'kendall': 0.4082814002056627, 'rmse': 2.584637548540263, 'mae': 1.8538037538528442, 'r2': 0.27057642773848956}, {'fold': 4, 'n_train': 4664, 'n_valid': 1555, 'spearman': 0.42238063437413426, 'pearson': 0.4780646894042643, 'kendall': 0.29387779425416705, 'rmse': 1.9940465294049396, 'mae': 1.5967419147491455, 'r2': 0.12531916320565273}]",,6219,0.7805421758374019,0.6702533687473461
legacy_rich_valid_smiles_only,drug_group_4fold,xgboost,completed,0.5341637817188954,0.5732055178656139,0.3793991190338289,2.2750265853502225,1.7140849828720093,0.32522621535069574,0.5367979187123243,0.1175157553723239,"[{'fold': 1, 'n_train': 4664, 'n_valid': 1555, 'spearman': 0.6851167925807681, 'pearson': 0.7199644924960417, 'kendall': 0.4931529525272376, 'rmse': 2.0163105826313323, 'mae': 1.575985074043274, 'r2': 0.5102088834970198}, {'fold': 2, 'n_train': 4664, 'n_valid': 1555, 'spearman': 0.532414958283563, 'pearson': 0.5902489784716083, 'kendall': 0.38175549011869436, 'rmse': 2.3345963828885057, 'mae': 1.7611932754516602, 'r2': 0.28107591365758466}, {'fold': 3, 'n_train': 4665, 'n_valid': 1554, 'spearman': 0.5717489471315365, 'pearson': 0.5586097253662423, 'kendall': 0.41410930330270096, 'rmse': 2.5569003259583636, 'mae': 1.8336132764816284, 'r2': 0.2861482622053739}, {'fold': 4, 'n_train': 4664, 'n_valid': 1555, 'spearman': 0.3579109768534297, 'pearson': 0.37442215322993144, 'kendall': 0.24655369841064462, 'rmse': 2.15644835513439, 'mae': 1.6856247186660767, 'r2': -0.02295641695061712}]",,6219,0.7756595358498257,0.6546828793060167
legacy_rich_valid_smiles_only,drug_group_4fold,extratrees,completed,0.5234623721153524,0.580372933778472,0.372419743061335,2.2563618682433555,1.7067872285842896,0.33625266440749646,0.529805228679957,0.0808672274527757,"[{'fold': 1, 'n_train': 4664, 'n_valid': 1555, 'spearman': 0.6270202233214255, 'pearson': 0.6964924939152098, 'kendall': 0.44987127912673125, 'rmse': 2.0930619888639934, 'mae': 1.6512227058410645, 'r2': 0.472211086536483}, {'fold': 2, 'n_train': 4664, 'n_valid': 1555, 'spearman': 0.5564707411938199, 'pearson': 0.6234738308221861, 'kendall': 0.4045837128471682, 'rmse': 2.2739954522656918, 'mae': 1.6744965314865112, 'r2': 0.317914856475503}, {'fold': 3, 'n_train': 4665, 'n_valid': 1554, 'spearman': 0.5323748159651283, 'pearson': 0.5203032876363097, 'kendall': 0.3791717771075655, 'rmse': 2.6355733912813126, 'mae': 1.9118340015411377, 'r2': 0.24154350074485287}, {'fold': 4, 'n_train': 4664, 'n_valid': 1555, 'spearman': 0.4033551342394544, 'pearson': 0.4941631868662345, 'kendall': 0.28056561055193524, 'rmse': 1.9666358859137276, 'mae': 1.5897274017333984, 'r2': 0.14920113315514083}]",,6219,0.7747028691508051,0.6693540565055252
legacy_rich_valid_smiles_only,random_4fold,weighted_top3_ensemble,completed,0.8887093411523829,0.9248719667783523,0.7211519516528231,1.0672619080190826,0.827174961566925,0.8514996960815147,,,[],"[{'model': 'lightgbm', 'spearman': 0.8874658387436695, 'weight': 0.3361963629722595}, {'model': 'xgboost', 'spearman': 0.8809897408105439, 'weight': 0.33374303579330444}, {'model': 'flat_mlp', 'spearman': 0.8712691403116628, 'weight': 0.33006060123443604}]",6219,0.9549647179865473,0.9185155469340403
legacy_rich_valid_smiles_only,random_4fold,lightgbm,completed,0.8874658387436695,0.9236478883361589,0.719824294060009,1.0652379493667399,0.8190386891365051,0.8520623968499412,0.8878580380112485,0.0038039900377541,"[{'fold': 1, 'n_train': 4664, 'n_valid': 1555, 'spearman': 0.8901331963530502, 'pearson': 0.9254192304826546, 'kendall': 0.722974242435122, 'rmse': 1.0598994012096192, 'mae': 0.810950517654419, 'r2': 0.8555847214621982}, {'fold': 2, 'n_train': 4664, 'n_valid': 1555, 'spearman': 0.8875400252649711, 'pearson': 0.9239138276054064, 'kendall': 0.717614916418577, 'rmse': 1.0499922615856025, 'mae': 0.8211672306060791, 'r2': 0.8515339886393508}, {'fold': 3, 'n_train': 4664, 'n_valid': 1555, 'spearman': 0.8919137811452307, 'pearson': 0.9235442518321393, 'kendall': 0.7268869622833602, 'rmse': 1.053243425542059, 'mae': 0.8063962459564209, 'r2': 0.8522275235487946}, {'fold': 4, 'n_train': 4665, 'n_valid': 1554, 'spearman': 0.8818451492817422, 'pearson': 0.9219289327242212, 'kendall': 0.7150562518603168, 'rmse': 1.0971690552675972, 'mae': 0.8376526236534119, 'r2': 0.8489277524983406}]",,6219,0.9541407228202315,0.916576094212087
legacy_rich_valid_smiles_only,random_4fold,xgboost,completed,0.8809897408105439,0.9182234781013127,0.7110655915758154,1.1134556148574712,0.8644186854362488,0.8383665830212466,0.881608162619087,0.0022391919665776,"[{'fold': 1, 'n_train': 4664, 'n_valid': 1555, 'spearman': 0.8803793543335767, 'pearson': 0.9201888352263687, 'kendall': 0.7102282932051691, 'rmse': 1.108186272972718, 'mae': 0.8564081788063049, 'r2': 0.8421264481240586}, {'fold': 2, 'n_train': 4664, 'n_valid': 1555, 'spearman': 0.8792184516606134, 'pearson': 0.9170793259257751, 'kendall': 0.7068091405600156, 'rmse': 1.1077737131578806, 'mae': 0.8684152960777283, 'r2': 0.8347441144798167}, {'fold': 3, 'n_train': 4664, 'n_valid': 1555, 'spearman': 0.8851906105595627, 'pearson': 0.9176564599673013, 'kendall': 0.7181987137365011, 'rmse': 1.100151023467665, 'mae': 0.8476022481918335, 'r2': 0.8387719403261595}, {'fold': 4, 'n_train': 4665, 'n_valid': 1554, 'spearman': 0.8816442339225949, 'pearson': 0.9180979547874197, 'kendall': 0.7133281206604084, 'rmse': 1.1373640503180733, 'mae': 0.8852623701095581, 'r2': 0.8376558633255206}]",,6219,0.9509546647966067,0.9116802300819086
legacy_rich_valid_smiles_only,random_4fold,flat_mlp,completed,0.8712691403116628,0.9118970176778126,0.6985302592535012,1.143682327769968,0.8825993537902832,0.8294718307419846,0.8739461157987691,0.0096518891459451,"[{'fold': 1, 'n_train': 4664, 'n_valid': 1555, 'spearman': 0.8735542777733343, 'pearson': 0.9148503125248135, 'kendall': 0.7001887890389787, 'rmse': 1.1299224820175287, 'mae': 0.8745614886283875, 'r2': 0.8358725804361684}, {'fold': 2, 'n_train': 4664, 'n_valid': 1555, 'spearman': 0.8765012638154376, 'pearson': 0.9125012661604276, 'kendall': 0.7034553138275933, 'rmse': 1.1319883834694389, 'mae': 0.8707712888717651, 'r2': 0.8274405425476367}, {'fold': 3, 'n_train': 4664, 'n_valid': 1555, 'spearman': 0.8863480356788689, 'pearson': 0.9175345158342645, 'kendall': 0.7173379472653378, 'rmse': 1.0991882276601492, 'mae': 0.8439032435417175, 'r2': 0.8390540145210487}, {'fold': 4, 'n_train': 4665, 'n_valid': 1554, 'spearman': 0.8593808859274359, 'pearson': 0.908653730790788, 'kendall': 0.6870536015941486, 'rmse': 1.2107028856958468, 'mae': 0.9411988854408264, 'r2': 0.8160445098261649}]",,6219,0.9483155507779515,0.9090564906164647
legacy_rich_valid_smiles_only,random_4fold,randomforest,completed,0.8712681236498675,0.9092693308923581,0.7004600098351477,1.1596776315386903,0.8896185159683228,0.8246685273201168,0.8716844178843836,0.0032603411756566,"[{'fold': 1, 'n_train': 4664, 'n_valid': 1555, 'spearman': 0.8710496230677339, 'pearson': 0.9130232345048765, 'kendall': 0.6994356193117544, 'rmse': 1.1463861634594075, 'mae': 0.8862344026565552, 'r2': 0.8310548423372066}, {'fold': 2, 'n_train': 4664, 'n_valid': 1555, 'spearman': 0.8675764737400522, 'pearson': 0.907096818515265, 'kendall': 0.6972644190777362, 'rmse': 1.1554227395533752, 'mae': 0.8896209597587585, 'r2': 0.8202219508857014}, {'fold': 3, 'n_train': 4664, 'n_valid': 1555, 'spearman': 0.8767010040241038, 'pearson': 0.9065415404583325, 'kendall': 0.7070997922189066, 'rmse': 1.1593411340419986, 'mae': 0.8804050087928772, 'r2': 0.8209565118255868}, {'fold': 4, 'n_train': 4665, 'n_valid': 1554, 'spearman': 0.8714105707056442, 'pearson': 0.9104736582397965, 'kendall': 0.7015623977195149, 'rmse': 1.1773532737949186, 'mae': 0.9022216796875, 'r2': 0.8260392851006393}]",,6219,0.9480832087705164,0.9073297288425398
legacy_rich_valid_smiles_only,random_4fold,residual_mlp,completed,0.8623309789625315,0.8978645543862636,0.6851414150507487,1.225514054945025,0.9186285734176636,0.8041958480741083,0.8644688852780547,0.0095094059812477,"[{'fold': 1, 'n_train': 4664, 'n_valid': 1555, 'spearman': 0.8631784812224629, 'pearson': 0.895646864027832, 'kendall': 0.6848837180545442, 'rmse': 1.2442185693396035, 'mae': 0.9304550290107727, 'r2': 0.8009889214610655}, {'fold': 2, 'n_train': 4664, 'n_valid': 1555, 'spearman': 0.8523288273827605, 'pearson': 0.89533218454076, 'kendall': 0.6728997720661991, 'rmse': 1.23384329051802, 'mae': 0.9277014136314392, 'r2': 0.7949900938672669}, {'fold': 3, 'n_train': 4664, 'n_valid': 1555, 'spearman': 0.8790097282433001, 'pearson': 0.9119870277794268, 'kendall': 0.7076824649070786, 'rmse': 1.1383033011976984, 'mae': 0.8675547242164612, 'r2': 0.8273955261432464}, {'fold': 4, 'n_train': 4665, 'n_valid': 1554, 'spearman': 0.8633585042636949, 'pearson': 0.8916307199138694, 'kendall': 0.6863955931800811, 'rmse': 1.2811888238211575, 'mae': 0.9488226175308228, 'r2': 0.7940015809028906}]",,6219,0.9405653979054034,0.8946144735968055
legacy_rich_valid_smiles_only,random_4fold,extratrees,completed,0.8619571134957742,0.8986146679337094,0.6896482133707008,1.2165085648448017,0.9210576415061951,0.807062941181953,0.8621673003506766,0.0028586394367268,"[{'fold': 1, 'n_train': 4664, 'n_valid': 1555, 'spearman': 0.865806792477967, 'pearson': 0.9020816703523562, 'kendall': 0.6934963380342125, 'rmse': 1.205425985075905, 'mae': 0.9151808619499207, 'r2': 0.8132051261775495}, {'fold': 2, 'n_train': 4664, 'n_valid': 1555, 'spearman': 0.8578853549518299, 'pearson': 0.8977747063404113, 'kendall': 0.6851016987788598, 'rmse': 1.2030482081887643, 'mae': 0.9158024191856384, 'r2': 0.8050959446699709}, {'fold': 3, 'n_train': 4664, 'n_valid': 1555, 'spearman': 0.8631593269828997, 'pearson': 0.8935840880717658, 'kendall': 0.6904925367808601, 'rmse': 1.2300974936730564, 'mae': 0.9198218584060669, 'r2': 0.798435010923104}, {'fold': 4, 'n_train': 4665, 'n_valid': 1554, 'spearman': 0.8618177269900092, 'pearson': 0.9009483200333815, 'kendall': 0.6915873057480931, 'rmse': 1.227221560936857, 'mae': 0.9334333539009094, 'r2': 0.8109905351443955}]",,6219,0.9443369213895387,0.9010919416001909
legacy_rich_all_drugs_zero_smiles,random_4fold,lightgbm,completed,0.838825029654061,0.8922506133190754,0.662710079720039,1.2082825628115899,0.9115766286849976,0.7949061635507856,0.8391212300465383,0.0080559275975682,"[{'fold': 1, 'n_train': 5634, 'n_valid': 1879, 'spearman': 0.8464976845532601, 'pearson': 0.8971306967412113, 'kendall': 0.6705526180148353, 'rmse': 1.202921466207801, 'mae': 0.9150629639625549, 'r2': 0.8033870803959889}, {'fold': 2, 'n_train': 5635, 'n_valid': 1878, 'spearman': 0.8459167218343636, 'pearson': 0.8987788411797862, 'kendall': 0.6701424773895417, 'rmse': 1.1680324881522823, 'mae': 0.8956159949302673, 'r2': 0.8037360692955193}, {'fold': 3, 'n_train': 5635, 'n_valid': 1878, 'spearman': 0.8374472369996135, 'pearson': 0.8856321021956031, 'kendall': 0.6634400368363049, 'rmse': 1.236778044830471, 'mae': 0.9056400656700134, 'r2': 0.7840148898148658}, {'fold': 4, 'n_train': 5635, 'n_valid': 1878, 'spearman': 0.8266232767989158, 'pearson': 0.888087139599809, 'kendall': 0.6494540244004909, 'rmse': 1.2242768001851867, 'mae': 0.9299858212471008, 'r2': 0.7881354715082027}]",,7513,0.929435498498117,0.8808247623290507
legacy_rich_valid_smiles_only,scaffold_group_4fold,weighted_top3_ensemble,completed,0.5757928579258659,0.5865900036568017,0.41039755801271416,2.247697393725629,1.6866294145584106,0.34134041557727657,,,[],"[{'model': 'xgboost', 'spearman': 0.5587165000639226, 'weight': 0.33622244000434875}, {'model': 'lightgbm', 'spearman': 0.5537019875503886, 'weight': 0.33320486545562744}, {'model': 'randomforest', 'spearman': 0.5493280761192174, 'weight': 0.3305727243423462}]",6219,0.8000766789288245,0.6573822829160891
legacy_rich_valid_smiles_only,scaffold_group_4fold,xgboost,completed,0.5587165000639226,0.5692650513509891,0.3950203660918409,2.2801056173188887,1.7089736461639404,0.3222098598853198,0.559549495750566,0.0802169092885242,"[{'fold': 1, 'n_train': 4665, 'n_valid': 1554, 'spearman': 0.632351928162114, 'pearson': 0.7089724505339986, 'kendall': 0.4629073603272513, 'rmse': 2.0706815570599675, 'mae': 1.6142609119415283, 'r2': 0.4897005748633214}, {'fold': 2, 'n_train': 4666, 'n_valid': 1553, 'spearman': 0.527814117063705, 'pearson': 0.5080738844848961, 'kendall': 0.36900937921373456, 'rmse': 2.590671596867295, 'mae': 1.9612488746643066, 'r2': 0.25277118419765465}, {'fold': 3, 'n_train': 4666, 'n_valid': 1553, 'spearman': 0.4426094590795909, 'pearson': 0.4135233518259529, 'kendall': 0.307544792465158, 'rmse': 2.0119820727996287, 'mae': 1.5171139240264893, 'r2': 0.05734273949351587}, {'fold': 4, 'n_train': 4660, 'n_valid': 1559, 'spearman': 0.6354224786968544, 'pearson': 0.6017019280813697, 'kendall': 0.4530972928282775, 'rmse': 2.397211612703969, 'mae': 1.7431994676589966, 'r2': 0.33239361296607817}]",,6219,0.7932152494006426,0.6416781065618249
legacy_rich_valid_smiles_only,scaffold_group_4fold,lightgbm,completed,0.5537019875503886,0.5558316452344404,0.3917899264217959,2.3138618583163812,1.7452012300491333,0.30199243217699545,0.5550473181943124,0.0718271934023017,"[{'fold': 1, 'n_train': 4665, 'n_valid': 1554, 'spearman': 0.5950566043366704, 'pearson': 0.6220939186854041, 'kendall': 0.43304760915756974, 'rmse': 2.289940050664739, 'mae': 1.7752562761306763, 'r2': 0.37591076475908214}, {'fold': 2, 'n_train': 4666, 'n_valid': 1553, 'spearman': 0.5269153227545619, 'pearson': 0.5090298646701945, 'kendall': 0.3661432579453586, 'rmse': 2.5831253111567056, 'mae': 1.9654474258422852, 'r2': 0.2571180253826355}, {'fold': 3, 'n_train': 4666, 'n_valid': 1553, 'spearman': 0.45378318914125576, 'pearson': 0.41849263678327847, 'kendall': 0.31575663067700144, 'rmse': 2.0333957782391243, 'mae': 1.5225005149841309, 'r2': 0.03717048660346012}, {'fold': 4, 'n_train': 4660, 'n_valid': 1559, 'spearman': 0.6444341565447614, 'pearson': 0.6317506817056652, 'kendall': 0.462497133604032, 'rmse': 2.3162023444916597, 'mae': 1.7176876068115234, 'r2': 0.37675217149669693}]",,6219,0.7878237015539615,0.6233715206738291
legacy_rich_all_drugs_zero_smiles,scaffold_group_4fold,weighted_top3_ensemble,completed,0.5530088471337181,0.5813160519573927,0.39682149956348656,2.172255119157015,1.6154097318649292,0.3371164290697325,,,[],"[{'model': 'xgboost', 'spearman': 0.5228803518426569, 'weight': 0.3398595154285431}, {'model': 'flat_mlp', 'spearman': 0.513981373972352, 'weight': 0.334075391292572}, {'model': 'residual_mlp', 'spearman': 0.5016574042334585, 'weight': 0.3260651230812073}]",7513,0.7704842570972683,0.6574631437475797
legacy_rich_valid_smiles_only,scaffold_group_4fold,randomforest,completed,0.5493280761192174,0.5665269950515764,0.39043650685964876,2.289606543976651,1.715300440788269,0.3165495886972248,0.5576855816295201,0.0676594685569247,"[{'fold': 1, 'n_train': 4665, 'n_valid': 1554, 'spearman': 0.5946887679962846, 'pearson': 0.6723207000138157, 'kendall': 0.4311530937211586, 'rmse': 2.2007394414958505, 'mae': 1.7477401494979858, 'r2': 0.4235844136036836}, {'fold': 2, 'n_train': 4666, 'n_valid': 1553, 'spearman': 0.5236143339839064, 'pearson': 0.5442390520640777, 'kendall': 0.3663639841345271, 'rmse': 2.5445844026893014, 'mae': 1.8952680826187134, 'r2': 0.27912064807435766}, {'fold': 3, 'n_train': 4666, 'n_valid': 1553, 'spearman': 0.4674028602120623, 'pearson': 0.41736954432686135, 'kendall': 0.33093226701675416, 'rmse': 1.9487376259538762, 'mae': 1.4621306657791138, 'r2': 0.11567408829064907}, {'fold': 4, 'n_train': 4660, 'n_valid': 1559, 'spearman': 0.6450363643258269, 'pearson': 0.6100051002409054, 'kendall': 0.4601113204743583, 'rmse': 2.4189569429095656, 'mae': 1.755885362625122, 'r2': 0.32022681238204787}]",,6219,0.7872988391392547,0.647074615649478
legacy_rich_valid_smiles_only,scaffold_group_4fold,extratrees,completed,0.5361387785410562,0.5577634621501006,0.38170499962242266,2.3123848345148534,1.718619704246521,0.30288321634205484,0.5424677048270865,0.0650943136450802,"[{'fold': 1, 'n_train': 4665, 'n_valid': 1554, 'spearman': 0.6081689431119509, 'pearson': 0.7041773914784434, 'kendall': 0.44249532393232327, 'rmse': 2.1393792084438825, 'mae': 1.7036025524139404, 'r2': 0.4552791253533631}, {'fold': 2, 'n_train': 4666, 'n_valid': 1553, 'spearman': 0.5551042450130608, 'pearson': 0.567052070242749, 'kendall': 0.39315815198509424, 'rmse': 2.524366367265826, 'mae': 1.861213207244873, 'r2': 0.29053070930289115}, {'fold': 3, 'n_train': 4666, 'n_valid': 1553, 'spearman': 0.4347264448882019, 'pearson': 0.3897380816304951, 'kendall': 0.30461720907678047, 'rmse': 1.9838346812028314, 'mae': 1.488534927368164, 'r2': 0.08353359305825592}, {'fold': 4, 'n_train': 4660, 'n_valid': 1559, 'spearman': 0.5718711862951324, 'pearson': 0.5507083891801889, 'kendall': 0.4074657647659137, 'rmse': 2.5494252174184253, 'mae': 1.8207424879074097, 'r2': 0.24492114560432}]",,6219,0.7752735933299039,0.6437326338024167
legacy_rich_valid_smiles_only,scaffold_group_4fold,residual_mlp,completed,0.5253976748136536,0.566488299841603,0.3732478180666851,2.332164562510729,1.7358752489089966,0.2909061762145908,0.5274137663061307,0.0782644932997694,"[{'fold': 1, 'n_train': 4665, 'n_valid': 1554, 'spearman': 0.6243565767892351, 'pearson': 0.6885582281028518, 'kendall': 0.45252647653176337, 'rmse': 2.103867638620006, 'mae': 1.6496679782867432, 'r2': 0.47321271700081036}, {'fold': 2, 'n_train': 4666, 'n_valid': 1553, 'spearman': 0.4791679031046174, 'pearson': 0.4867010990176521, 'kendall': 0.3372745958356891, 'rmse': 2.677109526470206, 'mae': 1.9480373859405518, 'r2': 0.20207672417234757}, {'fold': 3, 'n_train': 4666, 'n_valid': 1553, 'spearman': 0.42694021306543134, 'pearson': 0.35669194436593193, 'kendall': 0.30056439805953683, 'rmse': 2.162177631847998, 'mae': 1.551390528678894, 'r2': -0.08865006262713204}, {'fold': 4, 'n_train': 4660, 'n_valid': 1559, 'spearman': 0.579190372265239, 'pearson': 0.6407129387829179, 'kendall': 0.4087602061206494, 'rmse': 2.342699654782036, 'mae': 1.7942354679107666, 'r2': 0.3624107307446772}]",,6219,0.767036553524804,0.651225461085717
legacy_rich_all_drugs_zero_smiles,scaffold_group_4fold,xgboost,completed,0.5228803518426569,0.5462352475722417,0.36980225910824555,2.2358180368046887,1.6790847778320312,0.29775522305295243,0.5270271216321283,0.0421216565426945,"[{'fold': 1, 'n_train': 5636, 'n_valid': 1877, 'spearman': 0.48440711653702795, 'pearson': 0.5068918400460527, 'kendall': 0.34351335022646096, 'rmse': 2.3644463811753322, 'mae': 1.732688307762146, 'r2': 0.23556827009133807}, {'fold': 2, 'n_train': 5636, 'n_valid': 1877, 'spearman': 0.5193637926714023, 'pearson': 0.6479553052450678, 'kendall': 0.3675069215917181, 'rmse': 2.1083535440956376, 'mae': 1.6407992839813232, 'r2': 0.3919973463514236}, {'fold': 3, 'n_train': 5630, 'n_valid': 1883, 'spearman': 0.5966521423592136, 'pearson': 0.5825405485550603, 'kendall': 0.42933251237343545, 'rmse': 1.880928458176071, 'mae': 1.4592212438583374, 'r2': 0.3255920301982619}, {'fold': 4, 'n_train': 5637, 'n_valid': 1876, 'spearman': 0.5076854349608696, 'pearson': 0.48846670668288394, 'kendall': 0.35625520917128706, 'rmse': 2.5352135227123194, 'mae': 1.8844423294067383, 'r2': 0.20883464223510406}]",,7513,0.7646181565957071,0.6263244596771144

outputs/reports/260423_PAAD_V2_original_core/summary.md

### drug_group_4fold

- weighted_top3_ensemble: Spearman 0.5768, RMSE 2.1862
- flat_mlp: Spearman 0.5560, RMSE 2.2033
- randomforest: Spearman 0.5380, RMSE 2.2632
- xgboost: Spearman 0.5342, RMSE 2.2750
- extratrees: Spearman 0.5235, RMSE 2.2564

### random_4fold

- weighted_top3_ensemble: Spearman 0.8887, RMSE 1.0673
- lightgbm: Spearman 0.8875, RMSE 1.0652
- xgboost: Spearman 0.8810, RMSE 1.1135
- flat_mlp: Spearman 0.8713, RMSE 1.1437
- randomforest: Spearman 0.8713, RMSE 1.1597

### scaffold_group_4fold

- weighted_top3_ensemble: Spearman 0.5758, RMSE 2.2477
- xgboost: Spearman 0.5587, RMSE 2.2801
- lightgbm: Spearman 0.5537, RMSE 2.3139
- randomforest: Spearman 0.5493, RMSE 2.2896
- extratrees: Spearman 0.5361, RMSE 2.3124

### drug_group_4fold

- weighted_top3_ensemble: Spearman 0.5470, RMSE 2.1524
- xgboost: Spearman 0.5220, RMSE 2.1905
- flat_mlp: Spearman 0.5118, RMSE 2.2189
- residual_mlp: Spearman 0.5000, RMSE 2.3213
- randomforest: Spearman 0.4869, RMSE 2.2379

### scaffold_group_4fold

- weighted_top3_ensemble: Spearman 0.5530, RMSE 2.1723
- xgboost: Spearman 0.5229, RMSE 2.2358
- flat_mlp: Spearman 0.5140, RMSE 2.2252
- residual_mlp: Spearman 0.5017, RMSE 2.3162
- randomforest: Spearman 0.4964, RMSE 2.2521

### drug_group_4fold

- weighted_top3_ensemble: Spearman 0.5415, RMSE 2.1891
- randomforest: Spearman 0.5383, RMSE 2.1914
- extratrees: Spearman 0.5011, RMSE 2.2501
- xgboost: Spearman 0.4856, RMSE 2.2769
- lightgbm: Spearman 0.4810, RMSE 2.3274