outputs/reports/260423_PAAD_V2_raw_lincs_yapc_only/benchmark_best_by_split.csv

variant,split,model,status,spearman,pearson,kendall,rmse,mae,r2,fold_spearman_mean,fold_spearman_std,folds,members,n_eval,sensitivity_auroc,sensitivity_auprc
legacy_rich_valid_smiles_only,drug_group_4fold,weighted_top3_ensemble,completed,0.6409766872554439,0.6954960774179204,0.4700996019704203,2.1689210192175645,1.6503527164459229,0.48301609556218805,,,[],"[{'model': 'randomforest', 'spearman': 0.6331624174331133, 'weight': 0.3416493833065033}, {'model': 'extratrees', 'spearman': 0.614481202933314, 'weight': 0.3315691351890564}, {'model': 'residual_mlp', 'spearman': 0.605608458986149, 'weight': 0.3267814815044403}]",4110,0.8253742957501564,0.7873463064289148
legacy_rich_valid_smiles_only,drug_group_4fold,randomforest,completed,0.6331624174331133,0.6885139545740094,0.4620555084382244,2.197568989474728,1.6915119886398315,0.4692688582965042,0.6295660264167227,0.0829989329735318,"[{'fold': 1, 'n_train': 3086, 'n_valid': 1024, 'spearman': 0.7269687864536342, 'pearson': 0.7390694724653876, 'kendall': 0.5441725664131278, 'rmse': 2.1733373754654877, 'mae': 1.617140531539917, 'r2': 0.5076153540761457}, {'fold': 2, 'n_train': 3077, 'n_valid': 1033, 'spearman': 0.6170517436130231, 'pearson': 0.693841493562417, 'kendall': 0.45017752367392977, 'rmse': 2.4930803857934616, 'mae': 1.9649794101715088, 'r2': 0.41877111667082534}, {'fold': 3, 'n_train': 3080, 'n_valid': 1030, 'spearman': 0.6717041730188884, 'pearson': 0.709281211243719, 'kendall': 0.5006090375322196, 'rmse': 2.0717634766541866, 'mae': 1.6267504692077637, 'r2': 0.48353120659224313}, {'fold': 4, 'n_train': 3087, 'n_valid': 1023, 'spearman': 0.5025394025813448, 'pearson': 0.6439351532613282, 'kendall': 0.35857944820682375, 'rmse': 2.019013978687734, 'mae': 1.5550203323364258, 'r2': 0.41238679841635506}]",,4110,0.8218594395050919,0.7868396402914551
legacy_rich_valid_smiles_only,drug_group_4fold,extratrees,completed,0.614481202933314,0.673168347749721,0.4491024885370114,2.2329702162782845,1.6992356777191162,0.45203169601845383,0.6102293267054856,0.0670625432325093,"[{'fold': 1, 'n_train': 3086, 'n_valid': 1024, 'spearman': 0.6771848129057852, 'pearson': 0.7191199750793785, 'kendall': 0.5048953346724979, 'rmse': 2.2283674453296585, 'mae': 1.6522371768951416, 'r2': 0.4823647687278979}, {'fold': 2, 'n_train': 3077, 'n_valid': 1033, 'spearman': 0.603888572990858, 'pearson': 0.6989637198457371, 'kendall': 0.44436168865603415, 'rmse': 2.4335594603448034, 'mae': 1.9086098670959473, 'r2': 0.44619290296188674}, {'fold': 3, 'n_train': 3080, 'n_valid': 1030, 'spearman': 0.6561755624500503, 'pearson': 0.6871005882733217, 'kendall': 0.4814519530245975, 'rmse': 2.1433644829479412, 'mae': 1.6698195934295654, 'r2': 0.4472155862282726}, {'fold': 4, 'n_train': 3087, 'n_valid': 1023, 'spearman': 0.5036683584752488, 'pearson': 0.608731254155145, 'kendall': 0.3654509265041228, 'rmse': 2.111003219067149, 'mae': 1.5644762516021729, 'r2': 0.3576219295553307}]",,4110,0.8113056648895909,0.778898442732371
legacy_rich_valid_smiles_only,drug_group_4fold,residual_mlp,completed,0.605608458986149,0.6691294395997258,0.4375285337132,2.2869906374293922,1.737032413482666,0.4251979377298558,0.6011237535193437,0.051962350176341,"[{'fold': 1, 'n_train': 3086, 'n_valid': 1024, 'spearman': 0.6483885092975643, 'pearson': 0.6690400688476692, 'kendall': 0.4708838333003619, 'rmse': 2.3464957874389527, 'mae': 1.7355631589889526, 'r2': 0.426029240545693}, {'fold': 2, 'n_train': 3077, 'n_valid': 1033, 'spearman': 0.6212365173087006, 'pearson': 0.7135178182540723, 'kendall': 0.4530554239698819, 'rmse': 2.3024766565852244, 'mae': 1.7740973234176636, 'r2': 0.5042473360542317}, {'fold': 3, 'n_train': 3080, 'n_valid': 1030, 'spearman': 0.6217120508860389, 'pearson': 0.6666815208897519, 'kendall': 0.45252762369709226, 'rmse': 2.3250818012572894, 'mae': 1.8020298480987549, 'r2': 0.3495106830304324}, {'fold': 4, 'n_train': 3087, 'n_valid': 1023, 'spearman': 0.5131579365850708, 'pearson': 0.6441990457728504, 'kendall': 0.36995794289288564, 'rmse': 2.1692606607834404, 'mae': 1.6356338262557983, 'r2': 0.321677122020134}]",,4110,0.8120873975590096,0.763813087154942
legacy_rich_valid_smiles_only,drug_group_4fold,flat_mlp,completed,0.6051311029751217,0.6838243208511724,0.4405075604642674,2.204727131401523,1.6936918497085571,0.46580571380762636,0.6098200972364349,0.0767988416686485,"[{'fold': 1, 'n_train': 3086, 'n_valid': 1024, 'spearman': 0.6743067996951324, 'pearson': 0.7313024978196476, 'kendall': 0.4981900246456122, 'rmse': 2.244246331788871, 'mae': 1.6533507108688354, 'r2': 0.4749613946499033}, {'fold': 2, 'n_train': 3077, 'n_valid': 1033, 'spearman': 0.621725552118049, 'pearson': 0.7109546537198917, 'kendall': 0.4545975582875304, 'rmse': 2.3513675241337806, 'mae': 1.848442554473877, 'r2': 0.48297016064424036}, {'fold': 3, 'n_train': 3080, 'n_valid': 1030, 'spearman': 0.6621063174569916, 'pearson': 0.685264778956053, 'kendall': 0.48485237326521363, 'rmse': 2.107672449298974, 'mae': 1.652204990386963, 'r2': 0.4654725650131438}, {'fold': 4, 'n_train': 3087, 'n_valid': 1023, 'spearman': 0.4811417196755668, 'pearson': 0.6038604322313947, 'kendall': 0.3454716059760073, 'rmse': 2.1051351251068176, 'mae': 1.619579792022705, 'r2': 0.36118819135344693}]",,4110,0.8038962098367899,0.7552843898852314
legacy_rich_valid_smiles_only,drug_group_4fold,xgboost,completed,0.5818645525021721,0.6225600065026466,0.41475414553814755,2.36652750313528,1.828574776649475,0.38452184143494683,0.5794139320310397,0.0854485255571866,"[{'fold': 1, 'n_train': 3086, 'n_valid': 1024, 'spearman': 0.6942790401445977, 'pearson': 0.6662850075424399, 'kendall': 0.5052771860407715, 'rmse': 2.3544944152441762, 'mae': 1.8077775239944458, 'r2': 0.4221095083005514}, {'fold': 2, 'n_train': 3077, 'n_valid': 1033, 'spearman': 0.494374440891035, 'pearson': 0.5379260778194219, 'kendall': 0.3481039908824247, 'rmse': 2.8006849711321755, 'mae': 2.2073357105255127, 'r2': 0.2664948634260005}, {'fold': 3, 'n_train': 3080, 'n_valid': 1030, 'spearman': 0.6290585020937826, 'pearson': 0.6919031458684431, 'kendall': 0.4545127746921689, 'rmse': 2.135037780891987, 'mae': 1.6878799200057983, 'r2': 0.4515022433476452}, {'fold': 4, 'n_train': 3087, 'n_valid': 1023, 'spearman': 0.49994374499474387, 'pearson': 0.6089205083818222, 'kendall': 0.3571600058636735, 'rmse': 2.107415087019884, 'mae': 1.6085866689682007, 'r2': 0.35980377604443814}]",,4110,0.809753706901137,0.7350158609257412
legacy_rich_valid_smiles_only,drug_group_4fold,lightgbm,completed,0.5560437975187744,0.6132650873917619,0.39455186870610287,2.3955261254650604,1.8570141792297363,0.36934567235033355,0.55301485244798,0.0889989182162117,"[{'fold': 1, 'n_train': 3086, 'n_valid': 1024, 'spearman': 0.6600291183143064, 'pearson': 0.6319981837280765, 'kendall': 0.4768178035633348, 'rmse': 2.435419808922256, 'mae': 1.862819790840149, 'r2': 0.38170191897672734}, {'fold': 2, 'n_train': 3077, 'n_valid': 1033, 'spearman': 0.5218790890935785, 'pearson': 0.5810427922041113, 'kendall': 0.3714761433511163, 'rmse': 2.6941975374475744, 'mae': 2.1205570697784424, 'r2': 0.3212130769289986}, {'fold': 3, 'n_train': 3080, 'n_valid': 1030, 'spearman': 0.6055824168036816, 'pearson': 0.6875031613921063, 'kendall': 0.4391637079678783, 'rmse': 2.193511332600668, 'mae': 1.7158994674682617, 'r2': 0.42104667498723736}, {'fold': 4, 'n_train': 3087, 'n_valid': 1023, 'spearman': 0.4245687855803531, 'pearson': 0.5570000941751282, 'kendall': 0.2974324737372066, 'rmse': 2.223514116459018, 'mae': 1.7271639108657837, 'r2': 0.2873230660419287}]",,4110,0.7899804988768826,0.7238965524844247
legacy_rich_all_drugs_zero_smiles,drug_group_4fold,weighted_top3_ensemble,completed,0.5535776653485596,0.6462449952566875,0.3999563251098026,2.03735654361013,1.5546866655349731,0.4168910524261533,,,[],"[{'model': 'randomforest', 'spearman': 0.541921594075349, 'weight': 0.3352451026439667}, {'model': 'xgboost', 'spearman': 0.5417416013906418, 'weight': 0.33513373136520386}, {'model': 'lightgbm', 'spearman': 0.5328305947476133, 'weight': 0.32962116599082947}]",7513,0.7754204437299611,0.679498216068665
legacy_rich_valid_smiles_only,random_4fold,lightgbm,completed,0.9110021673903513,0.9336780590014202,0.7500674446432185,1.0816689445890904,0.8306505680084229,0.8714185769382099,0.9113632469917736,0.0041546080210723,"[{'fold': 1, 'n_train': 3082, 'n_valid': 1028, 'spearman': 0.9045995748122929, 'pearson': 0.9324714134679233, 'kendall': 0.7406516340317173, 'rmse': 1.0801248661019545, 'mae': 0.8358975648880005, 'r2': 0.8688555465608292}, {'fold': 2, 'n_train': 3082, 'n_valid': 1028, 'spearman': 0.915828470587743, 'pearson': 0.9378536612038342, 'kendall': 0.7570722503669015, 'rmse': 1.04255056391247, 'mae': 0.7988328337669373, 'r2': 0.8792036105762882}, {'fold': 3, 'n_train': 3083, 'n_valid': 1027, 'spearman': 0.9119140754379439, 'pearson': 0.9321272673611709, 'kendall': 0.7550109710384771, 'rmse': 1.0859592902103659, 'mae': 0.8258065581321716, 'r2': 0.8687263440752804}, {'fold': 4, 'n_train': 3083, 'n_valid': 1027, 'spearman': 0.9131108671291148, 'pearson': 0.9329750924538462, 'kendall': 0.7517336742481202, 'rmse': 1.1167924088998886, 'mae': 0.8620911836624146, 'r2': 0.8689444118280276}]",,4110,0.9616508598292207,0.9414685346530975
legacy_rich_valid_smiles_only,random_4fold,weighted_top3_ensemble,completed,0.9103389673396252,0.9327354202388397,0.7494930697230089,1.0929903934890735,0.8398869037628174,0.8687128532574653,,,[],"[{'model': 'lightgbm', 'spearman': 0.9110021673903513, 'weight': 0.33492612838745117}, {'model': 'xgboost', 'spearman': 0.9075844155103574, 'weight': 0.33366960287094116}, {'model': 'randomforest', 'spearman': 0.9014226080484967, 'weight': 0.3314042389392853}]",4110,0.9615976702985569,0.9411901164829141
legacy_rich_valid_smiles_only,random_4fold,xgboost,completed,0.9075844155103574,0.9316491462501848,0.745587083409946,1.1039479176944873,0.853070855140686,0.8660672744839001,0.90780463866783,0.0055557586805015,"[{'fold': 1, 'n_train': 3082, 'n_valid': 1028, 'spearman': 0.8984382428820065, 'pearson': 0.9284497611548882, 'kendall': 0.7339757858635003, 'rmse': 1.1176610089913632, 'mae': 0.8633040189743042, 'r2': 0.8595822068228222}, {'fold': 2, 'n_train': 3082, 'n_valid': 1028, 'spearman': 0.9107315797958415, 'pearson': 0.9355261243780442, 'kendall': 0.7500288895582092, 'rmse': 1.06667863769569, 'mae': 0.8221326470375061, 'r2': 0.8735476526840064}, {'fold': 3, 'n_train': 3083, 'n_valid': 1027, 'spearman': 0.9092304630540812, 'pearson': 0.9301679752590398, 'kendall': 0.7503910076334505, 'rmse': 1.1035002310700341, 'mae': 0.8486658930778503, 'r2': 0.8644513072858743}, {'fold': 4, 'n_train': 3083, 'n_valid': 1027, 'spearman': 0.9128182689393904, 'pearson': 0.9330114230131559, 'kendall': 0.7515286797858134, 'rmse': 1.12701849524715, 'mae': 0.878200888633728, 'r2': 0.8665333575153382}]",,4110,0.9603827498169053,0.9403195449966693
legacy_rich_valid_smiles_only,random_4fold,randomforest,completed,0.9014226080484967,0.9241199341538471,0.7367535524205773,1.1559268396715667,0.8830896615982056,0.8531580161073508,0.901494134333724,0.0044083234464138,"[{'fold': 1, 'n_train': 3082, 'n_valid': 1028, 'spearman': 0.8939565662616764, 'pearson': 0.9249973659590724, 'kendall': 0.7271824852019719, 'rmse': 1.1374849444220905, 'mae': 0.8740085959434509, 'r2': 0.8545568376309084}, {'fold': 2, 'n_train': 3082, 'n_valid': 1028, 'spearman': 0.9031236506532353, 'pearson': 0.9270787082419664, 'kendall': 0.7378176190437311, 'rmse': 1.130842139552514, 'mae': 0.8681612610816956, 'r2': 0.8578772386681831}, {'fold': 3, 'n_train': 3083, 'n_valid': 1027, 'spearman': 0.9050847404489175, 'pearson': 0.9236760281718062, 'kendall': 0.7460253889680598, 'rmse': 1.149254436963163, 'mae': 0.8666693568229675, 'r2': 0.852977811745102}, {'fold': 4, 'n_train': 3083, 'n_valid': 1027, 'spearman': 0.9038115799710668, 'pearson': 0.9216389613560567, 'kendall': 0.7382116321233579, 'rmse': 1.2047001819462582, 'mae': 0.9235427975654602, 'r2': 0.8475004412069661}]",,4110,0.9580861383991588,0.9358420870244959
legacy_rich_valid_smiles_only,random_4fold,extratrees,completed,0.8978421308098261,0.9178473948432868,0.7313990666472392,1.1973570248936847,0.9001783132553101,0.842443310347096,0.8981830825302524,0.0028582023834726,"[{'fold': 1, 'n_train': 3082, 'n_valid': 1028, 'spearman': 0.8953302763203718, 'pearson': 0.9218814518170977, 'kendall': 0.7279378334468157, 'rmse': 1.1564008768980223, 'mae': 0.8757440447807312, 'r2': 0.8496793080063099}, {'fold': 2, 'n_train': 3082, 'n_valid': 1028, 'spearman': 0.8990920515364038, 'pearson': 0.9204785505246448, 'kendall': 0.7329907004475644, 'rmse': 1.1750963313607954, 'mae': 0.8883605599403381, 'r2': 0.8465359631713664}, {'fold': 3, 'n_train': 3083, 'n_valid': 1027, 'spearman': 0.9024582801089047, 'pearson': 0.9181610598928415, 'kendall': 0.7402831584256139, 'rmse': 1.1893680836511034, 'mae': 0.8862249255180359, 'r2': 0.8425353751914472}, {'fold': 4, 'n_train': 3083, 'n_valid': 1027, 'spearman': 0.8958517221553292, 'pearson': 0.9120628306878271, 'kendall': 0.7282480058347527, 'rmse': 1.2657367515676805, 'mae': 0.9504186511039734, 'r2': 0.8316560901085605}]",,4110,0.9574727966236924,0.9346283703223505
legacy_rich_valid_smiles_only,random_4fold,flat_mlp,completed,0.8742727402848457,0.903204752843597,0.7009599285269345,1.2970735329023793,0.9910057187080383,0.8151077380560712,0.8759903152702415,0.0267617558045487,"[{'fold': 1, 'n_train': 3082, 'n_valid': 1028, 'spearman': 0.8297560579599662, 'pearson': 0.8726813237558632, 'kendall': 0.6536648019692357, 'rmse': 1.4832103778299097, 'mae': 1.1248738765716553, 'r2': 0.7527094921367219}, {'fold': 2, 'n_train': 3082, 'n_valid': 1028, 'spearman': 0.8897616751472448, 'pearson': 0.9158972340418695, 'kendall': 0.7180174019451698, 'rmse': 1.2325769680511254, 'mae': 0.9383853077888489, 'r2': 0.8311551599555125}, {'fold': 3, 'n_train': 3083, 'n_valid': 1027, 'spearman': 0.8899207274603366, 'pearson': 0.9094995714764162, 'kendall': 0.7200025055321867, 'rmse': 1.2562463617983843, 'mae': 0.9626950025558472, 'r2': 0.8243289768752875}, {'fold': 4, 'n_train': 3083, 'n_valid': 1027, 'spearman': 0.8945228005134183, 'pearson': 0.9221029907631763, 'kendall': 0.7257031737288909, 'rmse': 1.1966368874127074, 'mae': 0.9379895925521851, 'r2': 0.8495350296755626}]",,4110,0.9457748078016764,0.9242728563043565
legacy_rich_valid_smiles_only,random_4fold,residual_mlp,completed,0.8632746090405252,0.8934555645521968,0.6853385886866921,1.3640623724064542,1.0368889570236206,0.7955166220521359,0.8689867880899838,0.0168082346659515,"[{'fold': 1, 'n_train': 3082, 'n_valid': 1028, 'spearman': 0.8531066147900411, 'pearson': 0.8823279507612757, 'kendall': 0.6708393875234511, 'rmse': 1.4190399075381182, 'mae': 1.084563136100769, 'r2': 0.7736444253152234}, {'fold': 2, 'n_train': 3082, 'n_valid': 1028, 'spearman': 0.8525758467607718, 'pearson': 0.8979462919104402, 'kendall': 0.6750790436638847, 'rmse': 1.3663777596506286, 'mae': 1.0729479789733887, 'r2': 0.7925080691485002}, {'fold': 3, 'n_train': 3083, 'n_valid': 1027, 'spearman': 0.87852893458139, 'pearson': 0.8850250443339742, 'kendall': 0.7047456173441818, 'rmse': 1.4026032104186736, 'mae': 0.9977789521217346, 'r2': 0.7810120963230256}, {'fold': 4, 'n_train': 3083, 'n_valid': 1027, 'spearman': 0.8917357562277318, 'pearson': 0.916797144706803, 'kendall': 0.7193825111410949, 'rmse': 1.26275549654462, 'mae': 0.992184042930603, 'r2': 0.8324481803866148}]",,4110,0.9403985737022779,0.9149774254019958
legacy_rich_all_drugs_zero_smiles,random_4fold,lightgbm,completed,0.7972555352075167,0.8658377946366195,0.6181972025007199,1.3383738292554654,1.0142173767089844,0.7483653324375403,0.7974448857373999,0.0102977727148156,"[{'fold': 1, 'n_train': 5634, 'n_valid': 1879, 'spearman': 0.7997095827349484, 'pearson': 0.8720965334316835, 'kendall': 0.6215065943470985, 'rmse': 1.332164679413924, 'mae': 1.0141059160232544, 'r2': 0.7588688243435532}, {'fold': 2, 'n_train': 5635, 'n_valid': 1878, 'spearman': 0.8116304129908637, 'pearson': 0.8759131129486394, 'kendall': 0.6304719554047314, 'rmse': 1.2858467913648741, 'mae': 0.9929370880126953, 'r2': 0.7621467567771061}, {'fold': 3, 'n_train': 5635, 'n_valid': 1878, 'spearman': 0.7956429160141857, 'pearson': 0.8566744153702632, 'kendall': 0.6179660476080715, 'rmse': 1.3738519036884698, 'mae': 1.018977403640747, 'r2': 0.733485956926051}, {'fold': 4, 'n_train': 5635, 'n_valid': 1878, 'spearman': 0.7827966312096017, 'pearson': 0.8595402591802314, 'kendall': 0.6051049438287686, 'rmse': 1.3599459446654891, 'mae': 1.0308490991592407, 'r2': 0.7385779096552154}]",,7513,0.9056334406576936,0.848346738029653
legacy_rich_valid_smiles_only,scaffold_group_4fold,randomforest,completed,0.6298134019846726,0.6708092089625827,0.45946795115438843,2.2592829895278768,1.7051501274108887,0.4390413783394552,0.6198235131625024,0.0881850736166761,"[{'fold': 1, 'n_train': 3086, 'n_valid': 1024, 'spearman': 0.7111295960204933, 'pearson': 0.7447256437556541, 'kendall': 0.5332578541027079, 'rmse': 2.263084513152762, 'mae': 1.6983624696731567, 'r2': 0.4855691283863395}, {'fold': 2, 'n_train': 3086, 'n_valid': 1024, 'spearman': 0.514675533583083, 'pearson': 0.5728980532972721, 'kendall': 0.36559743470488654, 'rmse': 2.3552336061435724, 'mae': 1.7678720951080322, 'r2': 0.2819816005427219}, {'fold': 3, 'n_train': 3078, 'n_valid': 1032, 'spearman': 0.5505285464982471, 'pearson': 0.5641249991522024, 'kendall': 0.39876835317931264, 'rmse': 2.4182614841036667, 'mae': 1.8118230104446411, 'r2': 0.31173059806765546}, {'fold': 4, 'n_train': 3080, 'n_valid': 1030, 'spearman': 0.7029603765481859, 'pearson': 0.789341743664619, 'kendall': 0.5222429075704852, 'rmse': 1.9753505926769703, 'mae': 1.5426613092422485, 'r2': 0.5812388934916222}]",,4110,0.8225327473620038,0.7857970610211233
legacy_rich_valid_smiles_only,scaffold_group_4fold,extratrees,completed,0.6215056558329645,0.6723146212246857,0.45295113810400817,2.250791940130755,1.6847026348114014,0.4432499590810123,0.6154923008306374,0.0690390602066362,"[{'fold': 1, 'n_train': 3086, 'n_valid': 1024, 'spearman': 0.6825495568308648, 'pearson': 0.7328123419058493, 'kendall': 0.5059936403813582, 'rmse': 2.290199492148374, 'mae': 1.7193706035614014, 'r2': 0.4731679651069015}, {'fold': 2, 'n_train': 3086, 'n_valid': 1024, 'spearman': 0.5393087349299743, 'pearson': 0.603422284934774, 'kendall': 0.38635582632226056, 'rmse': 2.288207639875812, 'mae': 1.7115826606750488, 'r2': 0.3222672906078431}, {'fold': 3, 'n_train': 3078, 'n_valid': 1032, 'spearman': 0.554012623940291, 'pearson': 0.5626110247425181, 'kendall': 0.4005804837411058, 'rmse': 2.447434257427049, 'mae': 1.7953335046768188, 'r2': 0.2950244283882314}, {'fold': 4, 'n_train': 3080, 'n_valid': 1030, 'spearman': 0.6860982876214193, 'pearson': 0.7846326560175833, 'kendall': 0.511561858590392, 'rmse': 1.9477301591605143, 'mae': 1.5126675367355347, 'r2': 0.5928677354332796}]",,4110,0.8172920442782386,0.7835058487036577
legacy_rich_valid_smiles_only,scaffold_group_4fold,weighted_top3_ensemble,completed,0.619346763312493,0.6668063457482116,0.4499048187288454,2.270838139613487,1.7100640535354614,0.43328866836634117,,,[],"[{'model': 'randomforest', 'spearman': 0.6298134019846726, 'weight': 0.3495238423347473}, {'model': 'extratrees', 'spearman': 0.6215056558329645, 'weight': 0.3449133634567261}, {'model': 'xgboost', 'spearman': 0.5505992470979804, 'weight': 0.305562824010849}]",4110,0.8172191643924733,0.7785694131077223
legacy_rich_valid_smiles_only,scaffold_group_4fold,xgboost,completed,0.5505992470979804,0.5870124438308144,0.3906085189763131,2.4421436386416366,1.8619672060012817,0.3445614969121653,0.542726620700638,0.057602144969906,"[{'fold': 1, 'n_train': 3086, 'n_valid': 1024, 'spearman': 0.6243147776666489, 'pearson': 0.6697320464726926, 'kendall': 0.45654765950212073, 'rmse': 2.3951143485149426, 'mae': 1.796513557434082, 'r2': 0.42379365828470716}, {'fold': 2, 'n_train': 3086, 'n_valid': 1024, 'spearman': 0.4880708169264939, 'pearson': 0.5104989536379693, 'kendall': 0.3517699630259846, 'rmse': 2.4701694319216045, 'mae': 1.8511760234832764, 'r2': 0.21019279827470483}, {'fold': 3, 'n_train': 3078, 'n_valid': 1032, 'spearman': 0.48885333858474445, 'pearson': 0.46443484026750526, 'kendall': 0.3421524317476894, 'rmse': 2.6037636915589544, 'mae': 1.9386347532272339, 'r2': 0.202087770304626}, {'fold': 4, 'n_train': 3080, 'n_valid': 1030, 'spearman': 0.5696675496246647, 'pearson': 0.6621716288145387, 'kendall': 0.40303787188594, 'rmse': 2.2882874514468714, 'mae': 1.86095130443573, 'r2': 0.4380481289078719}]",,4110,0.7854795905633589,0.7184071217542304
legacy_rich_valid_smiles_only,scaffold_group_4fold,residual_mlp,completed,0.5493005758654824,0.5618131863214936,0.3965971355100827,2.622761089466952,1.870751142501831,0.24402574723464188,0.5409535817540403,0.0827594333723745,"[{'fold': 1, 'n_train': 3086, 'n_valid': 1024, 'spearman': 0.6827725436231373, 'pearson': 0.7030276249690862, 'kendall': 0.49567600656131816, 'rmse': 2.267872294320641, 'mae': 1.6533653736114502, 'r2': 0.48339014569056793}, {'fold': 2, 'n_train': 3086, 'n_valid': 1024, 'spearman': 0.5007039577447981, 'pearson': 0.5737106986729286, 'kendall': 0.3571925009392795, 'rmse': 2.341255182605716, 'mae': 1.7304017543792725, 'r2': 0.29047930295399327}, {'fold': 3, 'n_train': 3078, 'n_valid': 1032, 'spearman': 0.5060698542004526, 'pearson': 0.5441639797502139, 'kendall': 0.3591646533080915, 'rmse': 2.547911263494203, 'mae': 1.921000599861145, 'r2': 0.23595210703037306}, {'fold': 4, 'n_train': 3080, 'n_valid': 1030, 'spearman': 0.47426797144777316, 'pearson': 0.46657463164058555, 'kendall': 0.3541790118935144, 'rmse': 3.2220227537861255, 'mae': 2.176055669784546, 'r2': -0.11412829551439807}]",,4110,0.7893940075856453,0.6565265553058945
legacy_rich_valid_smiles_only,scaffold_group_4fold,lightgbm,completed,0.548514512017246,0.5686079611677468,0.3882151173381024,2.486054914136511,1.8841599225997925,0.3207791596172661,0.536354515189965,0.1124752075464964,"[{'fold': 1, 'n_train': 3086, 'n_valid': 1024, 'spearman': 0.7176343730466231, 'pearson': 0.730492334693737, 'kendall': 0.5266823672640295, 'rmse': 2.2262735815154024, 'mae': 1.6673157215118408, 'r2': 0.5021682701941981}, {'fold': 2, 'n_train': 3086, 'n_valid': 1024, 'spearman': 0.4738567691132464, 'pearson': 0.4779065643549069, 'kendall': 0.33565509683295336, 'rmse': 2.4868873033317485, 'mae': 1.8929020166397095, 'r2': 0.1994660305561714}, {'fold': 3, 'n_train': 3078, 'n_valid': 1032, 'spearman': 0.41874087312478914, 'pearson': 0.3840880542702454, 'kendall': 0.2951047100666127, 'rmse': 2.7459722847481065, 'mae': 1.9862803220748901, 'r2': 0.11254921066919843}, {'fold': 4, 'n_train': 3080, 'n_valid': 1030, 'spearman': 0.5351860454752014, 'pearson': 0.6059874989432362, 'kendall': 0.37800345567217386, 'rmse': 2.4557817978678425, 'mae': 1.9887311458587646, 'r2': 0.3527717071917076}]",,4110,0.7814524015073094,0.6872533837806765
legacy_rich_all_drugs_zero_smiles,scaffold_group_4fold,weighted_top3_ensemble,completed,0.5443059853164065,0.6182395552311366,0.38871162366893497,2.1057334832552863,1.5895302295684814,0.3770941179408165,,,[],"[{'model': 'randomforest', 'spearman': 0.519580862571643, 'weight': 0.3382474482059479}, {'model': 'residual_mlp', 'spearman': 0.5194566146953477, 'weight': 0.33816659450531006}, {'model': 'flat_mlp', 'spearman': 0.49705936908486487, 'weight': 0.32358595728874207}]",7513,0.7667992740884643,0.6661165804383186
colonstyle_compact_baseline,scaffold_group_4fold,weighted_top3_ensemble,completed,0.519873414445466,0.5817849049706276,0.3702577223075122,2.178234094325915,1.6639360189437866,0.3334622065330046,,,[],"[{'model': 'lightgbm', 'spearman': 0.5086367382633193, 'weight': 0.3400830924510956}, {'model': 'xgboost', 'spearman': 0.4997291707319853, 'weight': 0.33412736654281616}, {'model': 'randomforest', 'spearman': 0.4872588523162356, 'weight': 0.32578951120376587}]",7513,0.7544284163726256,0.627674796636146

outputs/reports/260423_PAAD_V2_raw_lincs_yapc_only/summary.md

### drug_group_4fold

- weighted_top3_ensemble: Spearman 0.6410, RMSE 2.1689
- randomforest: Spearman 0.6332, RMSE 2.1976
- extratrees: Spearman 0.6145, RMSE 2.2330
- residual_mlp: Spearman 0.6056, RMSE 2.2870
- flat_mlp: Spearman 0.6051, RMSE 2.2047

### random_4fold

- lightgbm: Spearman 0.9110, RMSE 1.0817
- weighted_top3_ensemble: Spearman 0.9103, RMSE 1.0930
- xgboost: Spearman 0.9076, RMSE 1.1039
- randomforest: Spearman 0.9014, RMSE 1.1559
- extratrees: Spearman 0.8978, RMSE 1.1974

### scaffold_group_4fold

- randomforest: Spearman 0.6298, RMSE 2.2593
- extratrees: Spearman 0.6215, RMSE 2.2508
- weighted_top3_ensemble: Spearman 0.6193, RMSE 2.2708
- xgboost: Spearman 0.5506, RMSE 2.4421
- residual_mlp: Spearman 0.5493, RMSE 2.6228

### drug_group_4fold

- weighted_top3_ensemble: Spearman 0.5536, RMSE 2.0374
- randomforest: Spearman 0.5419, RMSE 2.0600
- xgboost: Spearman 0.5417, RMSE 2.0567
- lightgbm: Spearman 0.5328, RMSE 2.1241
- extratrees: Spearman 0.5263, RMSE 2.1076

### scaffold_group_4fold

- weighted_top3_ensemble: Spearman 0.5443, RMSE 2.1057
- randomforest: Spearman 0.5196, RMSE 2.1342
- residual_mlp: Spearman 0.5195, RMSE 2.2046
- flat_mlp: Spearman 0.4971, RMSE 2.1747
- extratrees: Spearman 0.4801, RMSE 2.2039

- weighted_top3_ensemble: Spearman 0.5199, RMSE 2.1782
- lightgbm: Spearman 0.5086, RMSE 2.1763
- xgboost: Spearman 0.4997, RMSE 2.2019
- randomforest: Spearman 0.4873, RMSE 2.2967
- extratrees: Spearman 0.4718, RMSE 2.3283