outputs/reports/260423_PAAD_V2_raw_no_lincs/benchmark_best_by_split.csv

variant,split,model,status,spearman,pearson,kendall,rmse,mae,r2,fold_spearman_mean,fold_spearman_std,folds,members,n_eval,sensitivity_auroc,sensitivity_auprc
legacy_rich_valid_smiles_only,drug_group_4fold,weighted_top3_ensemble,completed,0.4988797633374033,0.5226007725810171,0.3527004126444784,2.5751110608492223,1.977622151374817,0.2712451169556336,,,[],"[{'model': 'extratrees', 'spearman': 0.48502738613203283, 'weight': 0.34358084201812744}, {'model': 'randomforest', 'spearman': 0.4836615972110273, 'weight': 0.3426133394241333}, {'model': 'flat_mlp', 'spearman': 0.44299450590456635, 'weight': 0.31380584836006165}]",4110,0.7382833436984726,0.6396656490397924
legacy_rich_all_drugs_zero_smiles,drug_group_4fold,weighted_top3_ensemble,completed,0.49575595181667553,0.5350224365838422,0.3491355609962474,2.2540615299359743,1.7167044878005981,0.28624840227937176,,,[],"[{'model': 'randomforest', 'spearman': 0.4798103904154974, 'weight': 0.3395554721355438}, {'model': 'extratrees', 'spearman': 0.4707912192837159, 'weight': 0.3331727385520935}, {'model': 'xgboost', 'spearman': 0.46245290447933335, 'weight': 0.32727181911468506}]",7513,0.7397811973322279,0.589269150313144
legacy_rich_valid_smiles_only,drug_group_4fold,extratrees,completed,0.48502738613203283,0.5187302382489539,0.3415817356283414,2.5822054851800798,1.9968602657318115,0.2672241488915994,0.4862444168858482,0.0880816075650399,"[{'fold': 1, 'n_train': 3086, 'n_valid': 1024, 'spearman': 0.5507947482830337, 'pearson': 0.6364643246000014, 'kendall': 0.39319999093876595, 'rmse': 2.4977782867848943, 'mae': 1.9674052000045776, 'r2': 0.349633747403159}, {'fold': 2, 'n_train': 3077, 'n_valid': 1033, 'spearman': 0.36603962093684167, 'pearson': 0.3664878198238812, 'kendall': 0.2540037802928734, 'rmse': 3.0429449313092194, 'mae': 2.362423896789551, 'r2': 0.13410982657471116}, {'fold': 3, 'n_train': 3080, 'n_valid': 1030, 'spearman': 0.5877901353102923, 'pearson': 0.6158547147517741, 'kendall': 0.42342591395747936, 'rmse': 2.347372383817038, 'mae': 1.8754185438156128, 'r2': 0.3369783385189137}, {'fold': 4, 'n_train': 3087, 'n_valid': 1023, 'spearman': 0.44035316301322514, 'pearson': 0.45001444881005526, 'kendall': 0.3061289493328417, 'rmse': 2.3760426892706645, 'mae': 1.7794798612594604, 'r2': 0.1861930215987463}]",,4110,0.7285222976649796,0.6335836877554528
legacy_rich_valid_smiles_only,drug_group_4fold,randomforest,completed,0.4836615972110273,0.5090633100793899,0.34058595378189,2.5965719842685906,2.010416269302368,0.259047646738525,0.4929253713734659,0.0977503614997072,"[{'fold': 1, 'n_train': 3086, 'n_valid': 1024, 'spearman': 0.5705475167558339, 'pearson': 0.6545886835248781, 'kendall': 0.4106391429278246, 'rmse': 2.5088600513932233, 'mae': 1.9522510766983032, 'r2': 0.34385007914927435}, {'fold': 2, 'n_train': 3077, 'n_valid': 1033, 'spearman': 0.33200579411864767, 'pearson': 0.3114245800530516, 'kendall': 0.2260915243585988, 'rmse': 3.1111078848897766, 'mae': 2.456170082092285, 'r2': 0.09488284411697157}, {'fold': 3, 'n_train': 3080, 'n_valid': 1030, 'spearman': 0.5721971774099883, 'pearson': 0.6040825815652382, 'kendall': 0.411994312504842, 'rmse': 2.3745833583585685, 'mae': 1.8977335691452026, 'r2': 0.3215176289408991}, {'fold': 4, 'n_train': 3087, 'n_valid': 1023, 'spearman': 0.4969509972093937, 'pearson': 0.4845527607336469, 'kendall': 0.3473272111954895, 'rmse': 2.3099797924198255, 'mae': 1.731980562210083, 'r2': 0.2308175739259256}]",,4110,0.7331359780122664,0.619224869102801
legacy_rich_all_drugs_zero_smiles,drug_group_4fold,randomforest,completed,0.4798103904154974,0.5221014440857632,0.3368452445582032,2.2762559546906513,1.7390074729919434,0.27212328242262607,0.483202519838583,0.0378418265609783,"[{'fold': 1, 'n_train': 5635, 'n_valid': 1878, 'spearman': 0.5001798412799043, 'pearson': 0.5450238829755774, 'kendall': 0.3544687555664313, 'rmse': 2.2107213861636232, 'mae': 1.7500152587890625, 'r2': 0.2970408762617157}, {'fold': 2, 'n_train': 5634, 'n_valid': 1879, 'spearman': 0.44522441338618896, 'pearson': 0.5191769354026415, 'kendall': 0.31285983864562233, 'rmse': 2.3213691745746794, 'mae': 1.7882176637649536, 'r2': 0.2629906932518009}, {'fold': 3, 'n_train': 5635, 'n_valid': 1878, 'spearman': 0.5371594012227247, 'pearson': 0.6426102270638299, 'kendall': 0.3834105041518642, 'rmse': 1.9345420284601056, 'mae': 1.535145878791809, 'r2': 0.41174959034896785}, {'fold': 4, 'n_train': 5635, 'n_valid': 1878, 'spearman': 0.45024642346551413, 'pearson': 0.38295642680880226, 'kendall': 0.3094956843996108, 'rmse': 2.589740825926639, 'mae': 1.8826247453689575, 'r2': 0.14030397917598525}]",,7513,0.7316336316515247,0.5775590847526408
colonstyle_compact_baseline,drug_group_4fold,weighted_top3_ensemble,completed,0.47548381984264165,0.522309321604695,0.33556864881481285,2.275648686915128,1.7264469861984253,0.27251164589660704,,,[],"[{'model': 'extratrees', 'spearman': 0.4633512848872843, 'weight': 0.3455609977245331}, {'model': 'randomforest', 'spearman': 0.4605905592731733, 'weight': 0.34350210428237915}, {'model': 'flat_mlp', 'spearman': 0.4169249368627728, 'weight': 0.3109368681907654}]",7513,0.7252985670569723,0.5811259419780079
legacy_rich_all_drugs_zero_smiles,drug_group_4fold,extratrees,completed,0.4707912192837159,0.5132631874098691,0.32987497803601723,2.297824896752151,1.7439963817596436,0.25826379939505617,0.4735067935328438,0.0359001273756087,"[{'fold': 1, 'n_train': 5635, 'n_valid': 1878, 'spearman': 0.49445456938318116, 'pearson': 0.5526027454037795, 'kendall': 0.3501027003210993, 'rmse': 2.199194791131427, 'mae': 1.7339667081832886, 'r2': 0.3043521486057138}, {'fold': 2, 'n_train': 5634, 'n_valid': 1879, 'spearman': 0.44219437847618354, 'pearson': 0.5243049785243302, 'kendall': 0.3102349330055799, 'rmse': 2.3150725618199743, 'mae': 1.792699933052063, 'r2': 0.26698349971828195}, {'fold': 3, 'n_train': 5635, 'n_valid': 1878, 'spearman': 0.5215976615829324, 'pearson': 0.6190413893907171, 'kendall': 0.3711775120335683, 'rmse': 1.9882074428566774, 'mae': 1.5380146503448486, 'r2': 0.3786600562269571}, {'fold': 4, 'n_train': 5635, 'n_valid': 1878, 'spearman': 0.4357805646890785, 'pearson': 0.3552528989611951, 'kendall': 0.29923287217831174, 'rmse': 2.6402589442677105, 'mae': 1.9112778902053833, 'r2': 0.10643677098617599}]",,7513,0.726504004712081,0.5777146110549997
colonstyle_compact_baseline,drug_group_4fold,extratrees,completed,0.4633512848872843,0.5006880550713126,0.3263703240671484,2.3204322039106327,1.7584348917007446,0.24359673917812807,0.4660680821935072,0.0342928255062252,"[{'fold': 1, 'n_train': 5635, 'n_valid': 1878, 'spearman': 0.5007013538214271, 'pearson': 0.5324799954657377, 'kendall': 0.3559715125280706, 'rmse': 2.2377837528619144, 'mae': 1.765032172203064, 'r2': 0.2797251376827279}, {'fold': 2, 'n_train': 5634, 'n_valid': 1879, 'spearman': 0.4512479022102141, 'pearson': 0.5375181053252588, 'kendall': 0.31960159011822725, 'rmse': 2.2937078113469966, 'mae': 1.7493218183517456, 'r2': 0.2804504723879887}, {'fold': 3, 'n_train': 5635, 'n_valid': 1878, 'spearman': 0.49545918888474716, 'pearson': 0.5947836705878671, 'kendall': 0.3531985254197158, 'rmse': 2.0496961647591503, 'mae': 1.5996825695037842, 'r2': 0.3396337228148556}, {'fold': 4, 'n_train': 5635, 'n_valid': 1878, 'spearman': 0.4168638838576405, 'pearson': 0.3399604033263679, 'kendall': 0.28789668623058895, 'rmse': 2.658507700336605, 'mae': 1.9197074174880981, 'r2': 0.09404195071938681}]",,7513,0.7180689359500838,0.5659935562536219
legacy_rich_valid_smiles_only,random_4fold,lightgbm,completed,0.9106518808763724,0.9348313583049278,0.7502176111172033,1.0750322070952638,0.8300041556358337,0.8729915693488073,0.911308328296614,0.0046431490819819,"[{'fold': 1, 'n_train': 3082, 'n_valid': 1028, 'spearman': 0.9033189371899041, 'pearson': 0.9321427736222029, 'kendall': 0.7405266039581923, 'rmse': 1.0855646385230229, 'mae': 0.8446323275566101, 'r2': 0.8675312857214859}, {'fold': 2, 'n_train': 3082, 'n_valid': 1028, 'spearman': 0.9148374296606855, 'pearson': 0.9397041845772526, 'kendall': 0.7560151779270816, 'rmse': 1.0303100579429243, 'mae': 0.799388587474823, 'r2': 0.8820234951316894}, {'fold': 3, 'n_train': 3083, 'n_valid': 1027, 'spearman': 0.9135791831300466, 'pearson': 0.9326267440137661, 'kendall': 0.7566585175608942, 'rmse': 1.0832565476030158, 'mae': 0.826808750629425, 'r2': 0.869378962515017}, {'fold': 4, 'n_train': 3083, 'n_valid': 1027, 'spearman': 0.9134977632058197, 'pearson': 0.935565054566338, 'kendall': 0.7532103936154791, 'rmse': 1.099733118713779, 'mae': 0.8492025136947632, 'r2': 0.8729176476671792}]",,4110,0.9614296629829507,0.9408368340952363
legacy_rich_valid_smiles_only,random_4fold,weighted_top3_ensemble,completed,0.9088759736844296,0.9327494406762653,0.7477997887726671,1.1007457979231663,0.8491871356964111,0.866843121775205,,,[],"[{'model': 'lightgbm', 'spearman': 0.9106518808763724, 'weight': 0.3354646563529968}, {'model': 'xgboost', 'spearman': 0.9045178379606134, 'weight': 0.3332050144672394}, {'model': 'randomforest', 'spearman': 0.8994287681047838, 'weight': 0.3313303291797638}]",4110,0.9620206293548929,0.9410193311185864
legacy_rich_valid_smiles_only,random_4fold,xgboost,completed,0.9045178379606134,0.9304098914293336,0.7417502589429454,1.1230506963250204,0.8716330528259277,0.861392003091553,0.90500647460069,0.0058156426575288,"[{'fold': 1, 'n_train': 3082, 'n_valid': 1028, 'spearman': 0.895575833466994, 'pearson': 0.9262829797756585, 'kendall': 0.7305469308168282, 'rmse': 1.1419617645089268, 'mae': 0.8887119889259338, 'r2': 0.853409750189044}, {'fold': 2, 'n_train': 3082, 'n_valid': 1028, 'spearman': 0.9083712410814259, 'pearson': 0.9367647575531526, 'kendall': 0.7475320768777746, 'rmse': 1.0652159031440407, 'mae': 0.8333344459533691, 'r2': 0.8738942399202552}, {'fold': 3, 'n_train': 3083, 'n_valid': 1027, 'spearman': 0.9051557740541772, 'pearson': 0.927056278219579, 'kendall': 0.7453117052210219, 'rmse': 1.1352603116418758, 'mae': 0.868287205696106, 'r2': 0.8565365097280746}, {'fold': 4, 'n_train': 3083, 'n_valid': 1027, 'spearman': 0.9109230498001631, 'pearson': 0.9320568271063088, 'kendall': 0.7484461704637171, 'rmse': 1.1478134847377641, 'mae': 0.8962191939353943, 'r2': 0.8615626660966392}]",,4110,0.9602615390595273,0.9384297574881993
legacy_rich_valid_smiles_only,random_4fold,randomforest,completed,0.8994287681047838,0.9231905508002269,0.7341775105103916,1.1712316654524972,0.8956218361854553,0.8492438023453743,0.9000380952957958,0.004900510927743,"[{'fold': 1, 'n_train': 3082, 'n_valid': 1028, 'spearman': 0.8917215270652733, 'pearson': 0.9220935096337168, 'kendall': 0.7262428652554807, 'rmse': 1.1683438314400647, 'mae': 0.8956019282341003, 'r2': 0.8465583432796303}, {'fold': 2, 'n_train': 3082, 'n_valid': 1028, 'spearman': 0.9019805956241029, 'pearson': 0.9287251378984926, 'kendall': 0.7374084297121879, 'rmse': 1.1245572490477322, 'mae': 0.8651639819145203, 'r2': 0.8594525980984467}, {'fold': 3, 'n_train': 3083, 'n_valid': 1027, 'spearman': 0.9044098325731169, 'pearson': 0.9221274885924685, 'kendall': 0.7426126140287672, 'rmse': 1.1676629728319998, 'mae': 0.8858014941215515, 'r2': 0.8482301500424024}, {'fold': 4, 'n_train': 3083, 'n_valid': 1027, 'spearman': 0.9020404259206901, 'pearson': 0.9206980254402549, 'kendall': 0.7359528968442357, 'rmse': 1.2223552784357197, 'mae': 0.9359497427940369, 'r2': 0.8429978755046458}]",,4110,0.9590407370432348,0.9368418453375356
legacy_rich_valid_smiles_only,random_4fold,extratrees,completed,0.8960568846121422,0.9168444266012139,0.7292195952890898,1.205562797037302,0.910300612449646,0.8402763698633151,0.8967950272612486,0.0044633259745276,"[{'fold': 1, 'n_train': 3082, 'n_valid': 1028, 'spearman': 0.8916367348398985, 'pearson': 0.917985185211673, 'kendall': 0.7238712452192264, 'rmse': 1.1849511046321521, 'mae': 0.8936976790428162, 'r2': 0.8421651807548061}, {'fold': 2, 'n_train': 3082, 'n_valid': 1028, 'spearman': 0.8973916077843528, 'pearson': 0.9198170802284161, 'kendall': 0.7306757496922599, 'rmse': 1.1824935987109746, 'mae': 0.8981730341911316, 'r2': 0.8445977719940931}, {'fold': 3, 'n_train': 3083, 'n_valid': 1027, 'spearman': 0.9036756994172199, 'pearson': 0.9187169570825428, 'kendall': 0.741996651833127, 'rmse': 1.1840880718273756, 'mae': 0.8900597095489502, 'r2': 0.8439303368952206}, {'fold': 4, 'n_train': 3083, 'n_valid': 1027, 'spearman': 0.8944760670035232, 'pearson': 0.912028741108323, 'kendall': 0.7257563204413409, 'rmse': 1.2685278110725833, 'mae': 0.9592999219894409, 'r2': 0.8309128437531573}]",,4110,0.958086905555851,0.9348597110969262
legacy_rich_valid_smiles_only,random_4fold,flat_mlp,completed,0.8651642934352243,0.8942473284638992,0.6872725149644289,1.3762412970576965,1.0680495500564575,0.7918489110552512,0.86610509040585,0.0094883191302229,"[{'fold': 1, 'n_train': 3082, 'n_valid': 1028, 'spearman': 0.8631582131503368, 'pearson': 0.8896418777207389, 'kendall': 0.6847972902769761, 'rmse': 1.3662458828430404, 'mae': 1.0464935302734375, 'r2': 0.7901738036035173}, {'fold': 2, 'n_train': 3082, 'n_valid': 1028, 'spearman': 0.8618538875289723, 'pearson': 0.8935635854322516, 'kendall': 0.6842858036236061, 'rmse': 1.3637044080461183, 'mae': 1.0436294078826904, 'r2': 0.7933192016558259}, {'fold': 3, 'n_train': 3083, 'n_valid': 1027, 'spearman': 0.8573055456856231, 'pearson': 0.8860179007367214, 'kendall': 0.6787644919998909, 'rmse': 1.4437633563328014, 'mae': 1.1296011209487915, 'r2': 0.7679708653095989}, {'fold': 4, 'n_train': 3083, 'n_valid': 1027, 'spearman': 0.8821027152584683, 'pearson': 0.9120630876699721, 'kendall': 0.7106588579118126, 'rmse': 1.3287022850677876, 'mae': 1.0525189638137817, 'r2': 0.8144905656223711}]",,4110,0.9396536645540876,0.9150430313574677
legacy_rich_valid_smiles_only,random_4fold,residual_mlp,completed,0.8368220932090882,0.8690048375233234,0.6538502099996866,1.5016179895220685,1.123278021812439,0.7521959001773089,0.8472818806291819,0.0125488125554201,"[{'fold': 1, 'n_train': 3082, 'n_valid': 1028, 'spearman': 0.825814853219267, 'pearson': 0.8543307087759008, 'kendall': 0.6372176641155299, 'rmse': 1.611484885248736, 'mae': 1.2407509088516235, 'r2': 0.7080863437756425}, {'fold': 2, 'n_train': 3082, 'n_valid': 1028, 'spearman': 0.8574484388782994, 'pearson': 0.8876044595673411, 'kendall': 0.6792732343122023, 'rmse': 1.4044430886074621, 'mae': 1.0572121143341064, 'r2': 0.7807861724853027}, {'fold': 3, 'n_train': 3083, 'n_valid': 1027, 'spearman': 0.8538934455707136, 'pearson': 0.8670842512828577, 'kendall': 0.6749493209053535, 'rmse': 1.5133628086687017, 'mae': 1.0739339590072632, 'r2': 0.7450608100692631}, {'fold': 4, 'n_train': 3083, 'n_valid': 1027, 'spearman': 0.8519707848484477, 'pearson': 0.8914650350120771, 'kendall': 0.6721958228730446, 'rmse': 1.4696114631270134, 'mae': 1.1211647987365723, 'r2': 0.7730575850247504}]",,4110,0.9333624682397128,0.9056557950820305
legacy_rich_all_drugs_zero_smiles,random_4fold,lightgbm,completed,0.7960436924120027,0.865612636894305,0.6166382960052657,1.3413091714397418,1.022756814956665,0.7472603356602345,0.7963552678952689,0.0111131565818301,"[{'fold': 1, 'n_train': 5634, 'n_valid': 1879, 'spearman': 0.7965112022529377, 'pearson': 0.8699886325024871, 'kendall': 0.617626223096717, 'rmse': 1.3442386803174353, 'mae': 1.0316158533096313, 'r2': 0.7544780810959281}, {'fold': 2, 'n_train': 5635, 'n_valid': 1878, 'spearman': 0.8110985143196108, 'pearson': 0.8757018057190699, 'kendall': 0.6299856654130221, 'rmse': 1.288702712278338, 'mae': 1.0032185316085815, 'r2': 0.7610890165815056}, {'fold': 3, 'n_train': 5635, 'n_valid': 1878, 'spearman': 0.7980059130014582, 'pearson': 0.8595042980479082, 'kendall': 0.6198032843357392, 'rmse': 1.3629455590322312, 'mae': 1.012835144996643, 'r2': 0.7377006115551465}, {'fold': 4, 'n_train': 5635, 'n_valid': 1878, 'spearman': 0.7798054420070688, 'pearson': 0.8580070035892965, 'kendall': 0.6021601043185869, 'rmse': 1.3678758033011753, 'mae': 1.0433531999588013, 'r2': 0.7355202953749431}]",,7513,0.9052435230398118,0.8472010591298613
legacy_rich_all_drugs_zero_smiles,scaffold_group_4fold,weighted_top3_ensemble,completed,0.4633882549324007,0.4910623174601522,0.32332788831160547,2.3295908160138663,1.7772125005722046,0.23761399281689166,,,[],"[{'model': 'randomforest', 'spearman': 0.42896533454025804, 'weight': 0.34194695949554443}, {'model': 'xgboost', 'spearman': 0.4225081079056214, 'weight': 0.33679962158203125}, {'model': 'flat_mlp', 'spearman': 0.4030057159719609, 'weight': 0.3212534189224243}]",7513,0.7160787279270944,0.5407417859588728
legacy_rich_valid_smiles_only,scaffold_group_4fold,extratrees,completed,0.45896604931963314,0.4910030467229692,0.3192102546315521,2.6303473911099085,2.015277147293091,0.2396461676159929,0.4587245624210935,0.1177074469771767,"[{'fold': 1, 'n_train': 3086, 'n_valid': 1024, 'spearman': 0.5152962374095384, 'pearson': 0.5153382692306283, 'kendall': 0.3576121261890583, 'rmse': 2.7567089779922838, 'mae': 2.1094932556152344, 'r2': 0.2366787184042517}, {'fold': 2, 'n_train': 3086, 'n_valid': 1024, 'spearman': 0.389998569710399, 'pearson': 0.4743621551496297, 'kendall': 0.26801466439760663, 'rmse': 2.5317824945663245, 'mae': 2.0092928409576416, 'r2': 0.17030137352370456}, {'fold': 3, 'n_train': 3078, 'n_valid': 1032, 'spearman': 0.31081683226575657, 'pearson': 0.3188550046537449, 'kendall': 0.212667807932925, 'rmse': 2.8243278176337747, 'mae': 2.1362459659576416, 'r2': 0.06118037559401923}, {'fold': 4, 'n_train': 3080, 'n_valid': 1030, 'spearman': 0.6187866102986802, 'pearson': 0.6244688168984135, 'kendall': 0.44682262425981306, 'rmse': 2.3848815939759267, 'mae': 1.8063552379608154, 'r2': 0.38960408746913266}]",,4110,0.7189641645765908,0.6239851166574865
legacy_rich_valid_smiles_only,scaffold_group_4fold,weighted_top3_ensemble,completed,0.4519613654816565,0.48023919441632007,0.31458300125531913,2.6459294599557577,2.040956735610962,0.2306107774993088,,,[],"[{'model': 'extratrees', 'spearman': 0.45896604931963314, 'weight': 0.35657358169555664}, {'model': 'randomforest', 'spearman': 0.42334961396930737, 'weight': 0.3289029598236084}, {'model': 'lightgbm', 'spearman': 0.4048409555998421, 'weight': 0.31452345848083496}]",4110,0.7117517409342538,0.6113002339807003
colonstyle_compact_baseline,scaffold_group_4fold,weighted_top3_ensemble,completed,0.4351929404276305,0.45513755232741215,0.3034598859803476,2.3771270462639538,1.8066617250442505,0.20618303399808002,,,[],"[{'model': 'extratrees', 'spearman': 0.4201868418006623, 'weight': 0.3383133113384247}, {'model': 'randomforest', 'spearman': 0.41193303004761594, 'weight': 0.3316677510738373}, {'model': 'xgboost', 'spearman': 0.4098852550918771, 'weight': 0.3300189673900604}]",7513,0.7010846154975297,0.5124093993263907
legacy_rich_all_drugs_zero_smiles,scaffold_group_4fold,randomforest,completed,0.42896533454025804,0.4621040413724014,0.29711487019241295,2.367020402808305,1.8062340021133423,0.212918780106633,0.4298160567392108,0.0137282947059399,"[{'fold': 1, 'n_train': 5635, 'n_valid': 1878, 'spearman': 0.4121071280391835, 'pearson': 0.4303772560829103, 'kendall': 0.2829624993307464, 'rmse': 2.4552137873031596, 'mae': 1.8383597135543823, 'r2': 0.17388021007179066}, {'fold': 2, 'n_train': 5634, 'n_valid': 1879, 'spearman': 0.4494494342319735, 'pearson': 0.45537485637390873, 'kendall': 0.31140809028261685, 'rmse': 2.617205537192976, 'mae': 2.039642572402954, 'r2': 0.20510442284250385}, {'fold': 3, 'n_train': 5635, 'n_valid': 1878, 'spearman': 0.4339985812715398, 'pearson': 0.4533396830097096, 'kendall': 0.3040086549647755, 'rmse': 2.357229204371552, 'mae': 1.749279499053955, 'r2': 0.20362327427338234}, {'fold': 4, 'n_train': 5635, 'n_valid': 1878, 'spearman': 0.4237090834141466, 'pearson': 0.5197217367732354, 'kendall': 0.29665928124502455, 'rmse': 1.994017773766156, 'mae': 1.5975298881530762, 'r2': 0.25586757708195784}]",,7513,0.7005649503036414,0.5263853911391081
legacy_rich_valid_smiles_only,scaffold_group_4fold,randomforest,completed,0.42334961396930737,0.45289257408767813,0.2956005090700488,2.6905937130977584,2.0713446140289307,0.20441649090392,0.4265151196232925,0.1201515553663413,"[{'fold': 1, 'n_train': 3086, 'n_valid': 1024, 'spearman': 0.5210792521630407, 'pearson': 0.5290437996533321, 'kendall': 0.36569367671891745, 'rmse': 2.758738764751667, 'mae': 2.1270034313201904, 'r2': 0.23555428937463252}, {'fold': 2, 'n_train': 3086, 'n_valid': 1024, 'spearman': 0.3637624225257075, 'pearson': 0.43646097413811547, 'kendall': 0.2545766989631808, 'rmse': 2.59842563793895, 'mae': 2.0436348915100098, 'r2': 0.1260467943532917}, {'fold': 3, 'n_train': 3078, 'n_valid': 1032, 'spearman': 0.2616810211963458, 'pearson': 0.2507353395522208, 'kendall': 0.1801171307461932, 'rmse': 2.8818561239126956, 'mae': 2.164511203765869, 'r2': 0.022545422724342568}, {'fold': 4, 'n_train': 3080, 'n_valid': 1030, 'spearman': 0.5595377826080761, 'pearson': 0.577383697848709, 'kendall': 0.3990598416297498, 'rmse': 2.5073652492534992, 'mae': 1.9502116441726685, 'r2': 0.3252961731822126}]",,4110,0.6945340597113854,0.5969530532180232
legacy_rich_all_drugs_zero_smiles,scaffold_group_4fold,xgboost,completed,0.4225081079056214,0.45949868784382175,0.29356298908225004,2.3734785527187863,1.818166732788086,0.20861786707247287,0.4242957043174131,0.0564154844431437,"[{'fold': 1, 'n_train': 5635, 'n_valid': 1878, 'spearman': 0.4455020185355872, 'pearson': 0.4658064752835023, 'kendall': 0.30884966112947115, 'rmse': 2.416157230307283, 'mae': 1.8102627992630005, 'r2': 0.19995433848450372}, {'fold': 2, 'n_train': 5634, 'n_valid': 1879, 'spearman': 0.506882970900577, 'pearson': 0.5432634079273182, 'kendall': 0.36040320250030755, 'rmse': 2.4717194287599225, 'mae': 1.921927809715271, 'r2': 0.29102200436962833}, {'fold': 3, 'n_train': 5635, 'n_valid': 1878, 'spearman': 0.37847795445115234, 'pearson': 0.39417290356467566, 'kendall': 0.2611611936126664, 'rmse': 2.451143472818517, 'mae': 1.8500183820724487, 'r2': 0.13890230836691497}, {'fold': 4, 'n_train': 5635, 'n_valid': 1878, 'spearman': 0.366319873382336, 'pearson': 0.43150810144429325, 'kendall': 0.255202205403448, 'rmse': 2.1396336174107358, 'mae': 1.690402865409851, 'r2': 0.14321661693185883}]",,7513,0.7030529739612306,0.5120504232026214
colonstyle_compact_baseline,scaffold_group_4fold,extratrees,completed,0.4201868418006623,0.4402710630227274,0.2925333623720802,2.402326679944435,1.8241804838180542,0.18926347784547226,0.4204723524629145,0.0443028011240512,"[{'fold': 1, 'n_train': 5635, 'n_valid': 1878, 'spearman': 0.4765537724249157, 'pearson': 0.5047565075236085, 'kendall': 0.33327687734636635, 'rmse': 2.349906059173106, 'mae': 1.7697558403015137, 'r2': 0.2432274235067734}, {'fold': 2, 'n_train': 5634, 'n_valid': 1879, 'spearman': 0.4510672411423088, 'pearson': 0.4101841591501772, 'kendall': 0.3136303344577392, 'rmse': 2.7029740837172884, 'mae': 2.0458385944366455, 'r2': 0.15215163160549972}, {'fold': 3, 'n_train': 5635, 'n_valid': 1878, 'spearman': 0.37454686054916636, 'pearson': 0.41845422063032234, 'kendall': 0.26011235289845125, 'rmse': 2.4159316446916517, 'mae': 1.8356144428253174, 'r2': 0.16346469739086322}, {'fold': 4, 'n_train': 5635, 'n_valid': 1878, 'spearman': 0.37972153573526707, 'pearson': 0.45029183331425837, 'kendall': 0.2662725451208716, 'rmse': 2.1021474711901407, 'mae': 1.6453955173492432, 'r2': 0.17297525628405475}]",,7513,0.6866019430416578,0.49510660137711776

outputs/reports/260423_PAAD_V2_raw_no_lincs/summary.md

### drug_group_4fold

- weighted_top3_ensemble: Spearman 0.4989, RMSE 2.5751
- extratrees: Spearman 0.4850, RMSE 2.5822
- randomforest: Spearman 0.4837, RMSE 2.5966
- flat_mlp: Spearman 0.4430, RMSE 2.6997
- residual_mlp: Spearman 0.4262, RMSE 2.7126

### random_4fold

- lightgbm: Spearman 0.9107, RMSE 1.0750
- weighted_top3_ensemble: Spearman 0.9089, RMSE 1.1007
- xgboost: Spearman 0.9045, RMSE 1.1231
- randomforest: Spearman 0.8994, RMSE 1.1712
- extratrees: Spearman 0.8961, RMSE 1.2056

### scaffold_group_4fold

- extratrees: Spearman 0.4590, RMSE 2.6303
- weighted_top3_ensemble: Spearman 0.4520, RMSE 2.6459
- randomforest: Spearman 0.4233, RMSE 2.6906
- lightgbm: Spearman 0.4048, RMSE 2.8540
- xgboost: Spearman 0.3889, RMSE 2.8140

### drug_group_4fold

- weighted_top3_ensemble: Spearman 0.4958, RMSE 2.2541
- randomforest: Spearman 0.4798, RMSE 2.2763
- extratrees: Spearman 0.4708, RMSE 2.2978
- xgboost: Spearman 0.4625, RMSE 2.3148
- residual_mlp: Spearman 0.4467, RMSE 2.3138

### scaffold_group_4fold

- weighted_top3_ensemble: Spearman 0.4634, RMSE 2.3296
- randomforest: Spearman 0.4290, RMSE 2.3670
- xgboost: Spearman 0.4225, RMSE 2.3735
- flat_mlp: Spearman 0.4030, RMSE 2.4416
- lightgbm: Spearman 0.3987, RMSE 2.4238

### drug_group_4fold

- weighted_top3_ensemble: Spearman 0.4755, RMSE 2.2756
- extratrees: Spearman 0.4634, RMSE 2.3204
- randomforest: Spearman 0.4606, RMSE 2.3142
- flat_mlp: Spearman 0.4169, RMSE 2.3262
- xgboost: Spearman 0.4145, RMSE 2.3961

### scaffold_group_4fold

- weighted_top3_ensemble: Spearman 0.4352, RMSE 2.3771
- extratrees: Spearman 0.4202, RMSE 2.4023
- randomforest: Spearman 0.4119, RMSE 2.4144
- xgboost: Spearman 0.4099, RMSE 2.4187
- residual_mlp: Spearman 0.3924, RMSE 2.5105